Enter password: ****
Welcome to the MySQL monitor.  Commands end with ; or \g.
Your MySQL connection id is 11
Server version: 8.0.41 MySQL Community Server - GPL

Copyright (c) 2000, 2025, Oracle and/or its affiliates.

Oracle is a registered trademark of Oracle Corporation and/or its
affiliates. Other names may be trademarks of their respective
owners.

Type 'help;' or '\h' for help. Type '\c' to clear the current input statement.

mysql> create database java11;
Query OK, 1 row affected (0.01 sec)

mysql> use java11
Database changed
mysql> drop database java11;
Query OK, 0 rows affected (0.03 sec)

mysql> use java11;
ERROR 1049 (42000): Unknown database 'java11'
mysql> create database java11;
Query OK, 1 row affected (0.02 sec)

mysql> use java11;
Database changed
mysql> create table books(bno int(3),bname varchar(10),price float(4));
Query OK, 0 rows affected, 1 warning (0.04 sec)

mysql> desc books
    -> ;
+-------+-------------+------+-----+---------+-------+
| Field | Type        | Null | Key | Default | Extra |
+-------+-------------+------+-----+---------+-------+
| bno   | int         | YES  |     | NULL    |       |
| bname | varchar(10) | YES  |     | NULL    |       |
| price | float       | YES  |     | NULL    |       |
+-------+-------------+------+-----+---------+-------+
3 rows in set (0.02 sec)

mysql> drop table books;
Query OK, 0 rows affected (0.04 sec)

mysql> create table books(bno int(3),bname varchar(10),price float(4));
Query OK, 0 rows affected, 1 warning (0.04 sec)

mysql> desc books;
+-------+-------------+------+-----+---------+-------+
| Field | Type        | Null | Key | Default | Extra |
+-------+-------------+------+-----+---------+-------+
| bno   | int         | YES  |     | NULL    |       |
| bname | varchar(10) | YES  |     | NULL    |       |
| price | float       | YES  |     | NULL    |       |
+-------+-------------+------+-----+---------+-------+
3 rows in set (0.00 sec)

mysql> select * from books;
Empty set (0.01 sec)

mysql> insert into books values(101,'Learn Java',500);
Query OK, 1 row affected (0.02 sec)

mysql> insert into books (bno, bname) values(102,'Learn Spring');
ERROR 1406 (22001): Data too long for column 'bname' at row 1
mysql> insert into books (bno, bname) values(102,'Learn C');
Query OK, 1 row affected (0.02 sec)

mysql> select * from books;
+------+------------+-------+
| bno  | bname      | price |
+------+------------+-------+
|  101 | Learn Java |   500 |
|  102 | Learn C    |  NULL |
+------+------------+-------+
2 rows in set (0.00 sec)

mysql> alter table books modify bname varchar(20);
Query OK, 0 rows affected (0.03 sec)
Records: 0  Duplicates: 0  Warnings: 0

mysql> desc books;
+-------+-------------+------+-----+---------+-------+
| Field | Type        | Null | Key | Default | Extra |
+-------+-------------+------+-----+---------+-------+
| bno   | int         | YES  |     | NULL    |       |
| bname | varchar(20) | YES  |     | NULL    |       |
| price | float       | YES  |     | NULL    |       |
+-------+-------------+------+-----+---------+-------+
3 rows in set (0.00 sec)

mysql> insert into books values (103,'Learn PHP',400), (104,'Learn Angular',600), (105,'Learn Spring',900);
Query OK, 3 rows affected (0.02 sec)
Records: 3  Duplicates: 0  Warnings: 0

mysql> select * from books;
+------+---------------+-------+
| bno  | bname         | price |
+------+---------------+-------+
|  101 | Learn Java    |   500 |
|  102 | Learn C       |  NULL |
|  103 | Learn PHP     |   400 |
|  104 | Learn Angular |   600 |
|  105 | Learn Spring  |   900 |
+------+---------------+-------+
5 rows in set (0.00 sec)

mysql> update books set price=550 where bno=102;
Query OK, 1 row affected (0.02 sec)
Rows matched: 1  Changed: 1  Warnings: 0

mysql> select * from books;
+------+---------------+-------+
| bno  | bname         | price |
+------+---------------+-------+
|  101 | Learn Java    |   500 |
|  102 | Learn C       |   550 |
|  103 | Learn PHP     |   400 |
|  104 | Learn Angular |   600 |
|  105 | Learn Spring  |   900 |
+------+---------------+-------+
5 rows in set (0.00 sec)

mysql> set autocommit = 0;
Query OK, 0 rows affected (0.00 sec)

mysql> delete from books;
Query OK, 5 rows affected (0.00 sec)

mysql> select * from books;
Empty set (0.00 sec)

mysql> rollback;
Query OK, 0 rows affected (0.02 sec)

mysql> select * from books;
+------+---------------+-------+
| bno  | bname         | price |
+------+---------------+-------+
|  101 | Learn Java    |   500 |
|  102 | Learn C       |   550 |
|  103 | Learn PHP     |   400 |
|  104 | Learn Angular |   600 |
|  105 | Learn Spring  |   900 |
+------+---------------+-------+
5 rows in set (0.00 sec)

mysql> commit;
Query OK, 0 rows affected (0.00 sec)

mysql> delete from books where bno=102;
Query OK, 1 row affected (0.00 sec)

mysql> select * from books;
+------+---------------+-------+
| bno  | bname         | price |
+------+---------------+-------+
|  101 | Learn Java    |   500 |
|  103 | Learn PHP     |   400 |
|  104 | Learn Angular |   600 |
|  105 | Learn Spring  |   900 |
+------+---------------+-------+
4 rows in set (0.00 sec)

mysql> rollback;
Query OK, 0 rows affected (0.02 sec)

mysql> select * from books;
+------+---------------+-------+
| bno  | bname         | price |
+------+---------------+-------+
|  101 | Learn Java    |   500 |
|  102 | Learn C       |   550 |
|  103 | Learn PHP     |   400 |
|  104 | Learn Angular |   600 |
|  105 | Learn Spring  |   900 |
+------+---------------+-------+
5 rows in set (0.00 sec)

mysql> commit;
Query OK, 0 rows affected (0.00 sec)

mysql> delete from books where price>=500 and price<=700;
Query OK, 3 rows affected (0.00 sec)

mysql> select * from books;
+------+--------------+-------+
| bno  | bname        | price |
+------+--------------+-------+
|  103 | Learn PHP    |   400 |
|  105 | Learn Spring |   900 |
+------+--------------+-------+
2 rows in set (0.00 sec)

mysql> rollback;
Query OK, 0 rows affected (0.02 sec)

mysql> commit;
Query OK, 0 rows affected (0.00 sec)

mysql> select * from books;
+------+---------------+-------+
| bno  | bname         | price |
+------+---------------+-------+
|  101 | Learn Java    |   500 |
|  102 | Learn C       |   550 |
|  103 | Learn PHP     |   400 |
|  104 | Learn Angular |   600 |
|  105 | Learn Spring  |   900 |
+------+---------------+-------+
5 rows in set (0.00 sec)

mysql> select * from books where bno=102;
+------+---------+-------+
| bno  | bname   | price |
+------+---------+-------+
|  102 | Learn C |   550 |
+------+---------+-------+
1 row in set (0.00 sec)

mysql> select * from books where price>=500 and price<=700;
+------+---------------+-------+
| bno  | bname         | price |
+------+---------------+-------+
|  101 | Learn Java    |   500 |
|  102 | Learn C       |   550 |
|  104 | Learn Angular |   600 |
+------+---------------+-------+
3 rows in set (0.00 sec)

mysql> alter table books rename to tempbooks;
Query OK, 0 rows affected (0.03 sec)

mysql> desc tempbooks;
+-------+-------------+------+-----+---------+-------+
| Field | Type        | Null | Key | Default | Extra |
+-------+-------------+------+-----+---------+-------+
| bno   | int         | YES  |     | NULL    |       |
| bname | varchar(20) | YES  |     | NULL    |       |
| price | float       | YES  |     | NULL    |       |
+-------+-------------+------+-----+---------+-------+
3 rows in set (0.00 sec)

mysql> alter table tempbooks rename to books;
Query OK, 0 rows affected (0.03 sec)

mysql> desc books;
+-------+-------------+------+-----+---------+-------+
| Field | Type        | Null | Key | Default | Extra |
+-------+-------------+------+-----+---------+-------+
| bno   | int         | YES  |     | NULL    |       |
| bname | varchar(20) | YES  |     | NULL    |       |
| price | float       | YES  |     | NULL    |       |
+-------+-------------+------+-----+---------+-------+
3 rows in set (0.00 sec)

mysql> alter table books add author varchar(10);
Query OK, 0 rows affected (0.04 sec)
Records: 0  Duplicates: 0  Warnings: 0

mysql> desc books;
+--------+-------------+------+-----+---------+-------+
| Field  | Type        | Null | Key | Default | Extra |
+--------+-------------+------+-----+---------+-------+
| bno    | int         | YES  |     | NULL    |       |
| bname  | varchar(20) | YES  |     | NULL    |       |
| price  | float       | YES  |     | NULL    |       |
| author | varchar(10) | YES  |     | NULL    |       |
+--------+-------------+------+-----+---------+-------+
4 rows in set (0.00 sec)

mysql>